Customer,routing_instance,p1_proposal,lifetime_secs,auth_method,auth_algo,enc_algo,dh_group,p1_mode,p1_preshared_key,DPD_opt,DPD_interval,NAT_keepalive,GW_ext_intf,netscr_local_id,p2_tunnel_desc,p2_tunnel_unit,ike_policy_description,p1_ike_gateway_name,p2_vpntun_name,ike_policy_name,p2_ipsec_policy_name,p2_security_zone,p2_proposal_name,p2_lifetime_secs,p2_protocol,p2_auth_algo,p2_enc_algo,p2_pfs_option,remote_ike_gw_ip,local_vpn_endpoint,p2_ike_proxy_id_local,p2_ike_proxy_id_remote,p2_vpn_mon_src_ip,p2_vpn_mon_dst_ip,p2_vpn_mon_opt,p2_ike_proxy_id_srv,p2_establish_tunnels,anti_replay,dscp_val,routes
DC PROD TUN1,WSDC-PART-VR,p1-pre-g5-aes256-sha1-86400,86400,pre-shared-key,sha1, aes-256-cbc, group5,main,#$MvcD34%#,,10,5,reth2.1320,,"DC,PR,PAY,DX-TUN1,ST0.4",st0.4,IKE Policy for IKE-DX-TUN1-VPN PROD WSDC,IKE-DXC-TUN1-GW,IPSEC-DX-TUN1-PROD-VPN,IKE-DX-TUN1-POL,IPSEC-DX-TUN1-PROD-POL,VPN-DXC-TUN,p2-esp-g5-aes256-sha1-3600,3600,esp,hmac-sha1-96,aes-256-cbc,perfect-forward-secrecy keys group5,198.18.20.106,198.18.240.7,198.18.220.64/29,198.18.70.144/28,198.18.228.65/32,198.18.70.145,optimized,any,immediately,yes,,"set routing-instances DC-PR-PART-VR routing-options static route 192.18.24.116/32 next-hop 20.36.83.1
set routing-instances WDSC-PR-PART-B2B-VR routing-options static route 198.18.72.110/28 next-hop st0.4
set routing-instances WSDC-PR-PART-B2B-VR routing-options static route 198.18.20.64/29 next-hop 10.23.18.9"
DC PROD TUN2,WSDC-PART-VR,p1-pre-g5-aes256-sha1-86400,86400,pre-shared-key,sha1, aes-256-cbc, group5,main,#$%fd4fGFd,,10,5,reth2.1320,,"DC,PR,PAY,DX-TUN2,ST0.5",st0.5,IKE Policy for IKE-DX-TUN2-VPN PROD WSDC,IKE-DXC-TUN2-GW,IPSEC-DX-TUN2-PROD-VPN,IKE-DX-TUN2-POL,IPSEC-DX-TUN2-PROD-POL,VPN-DXC-TUN,p2-esp-g5-aes256-sha1-3600,3600,esp,hmac-sha1-96,aes-256-cbc,perfect-forward-secrecy keys group5,198.18.30.106,198.18.240.7,198.18.220.64/29,198.18.80.144/28,198.18.228.65/32,198.18.80.145,optimized,any,immediately,yes,,"set routing-instances DC-PR-PART-VR routing-options static route 192.18.40.106/32 next-hop 20.36.83.1
set routing-instances WDSC-PR-PART-B2B-VR routing-options static route 198.18.90.110/28 next-hop st0.5
set routing-instances WSDC-PR-PART-B2B-VR routing-options static route 198.18.20.64/29 next-hop 10.23.18.9"
,,,,,,,,,,,,,,,,,,,,,,,,,,,,,,,,,,,,,,,,
